
  <!ELEMENT ListaContactos2 (MiContacto)+>
  <!-- Elemento Raiz del árbol: 
       - Son obligatorios: nombre, apellidos
       - Es opcional (?): fecha_nacimiento
       - Se compone de 1 o más subelementos: se usa +
       - Se compone de 0 o más subelementos: correos-->
  <!ELEMENT MiContacto (Nombre+, Telefono+, Email?) >
  <!-- Estableciendo los tipos de datos de los elementos hoja de PERSONACONTACTO-->
  <!ELEMENT Nombre (#PCDATA)>
  <!ELEMENT Telefono (#PCDATA)>
  <!ELEMENT Email (#PCDATA)>
